{
  "schema": "cwk.rt055.amendment8-migration2.v1",
  "data_class": "PUBLIC_SYNTHETIC_FAILED_READINESS",
  "status": "BLOCKED",
  "source_commit": "68ffbd67433b65c93f0614b640dbe7f5d67ca652",
  "migration_id": "bb049e96-1dbd-427d-adc6-7d7022b80ce0",
  "window_created": false,
  "formal_queries": 0,
  "formal_exposure": 0,
  "reason": "NATIVE_IMPORT_REQUEST_FAILURE_AFTER_DELIBERATE_SQL_FAULT_PROBE",
  "native_subtype_markers": {
    "SQLITE_BUSY": 1,
    "SQLITE_LOCKED": 0,
    "CONTENT_LIMIT": 0,
    "TRANSACTION_CLOSED": 0,
    "UNIQUE_CONSTRAINT": 0,
    "NO_SUCH_TABLE": 1,
    "SQL_SYNTAX": 0,
    "DISK_FULL": 0
  },
  "firewall_verified": true,
  "post_scan_hits": 0,
  "cleanup": {
    "complete": true,
    "failures": 0,
    "remaining_data_planes": 0,
    "remaining_processes": 0
  },
  "workload": {
    "schema": "cwk.rt055.public-workload.v1",
    "data_class": "PUBLIC_SYNTHETIC_ONLY_NOT_FORMAL_SCORES",
    "status": "BLOCKED",
    "migration_id": "bb049e96-1dbd-427d-adc6-7d7022b80ce0",
    "source_commit": "68ffbd67433b65c93f0614b640dbe7f5d67ca652",
    "counts": {
      "cwork-3m": 42,
      "docdb-touqian": 31,
      "spbp-2027": 42
    },
    "trial_counts": {
      "cwork-3m": 42,
      "docdb-touqian": 31,
      "spbp-2027": 42
    },
    "timeout_seconds": 7200,
    "document_byte_upper_bound": 524288,
    "ordinary_document_bytes": 8192,
    "private_reads": 0,
    "formal_queries": 0,
    "formal_attempts": 0,
    "cleanup_failures": 0,
    "remaining_runtime": 0,
    "native_sql_errorpath_injected": true,
    "candidates": {
      "a": {
        "firewall_verified": true,
        "libraries": {
          "cwork-3m": {
            "build_seconds": 2.392,
            "completed": 42,
            "failed": 0,
            "imported": 42,
            "pending": 0
          },
          "docdb-touqian": {
            "build_seconds": 2.03,
            "completed": 31,
            "failed": 0,
            "imported": 31,
            "pending": 0
          },
          "spbp-2027": {
            "build_seconds": 2.628,
            "completed": 42,
            "failed": 0,
            "imported": 42,
            "pending": 0
          }
        },
        "post_scan_hits": 0,
        "redactions": 18,
        "searches": 3
      },
      "b": {
        "firewall_verified": false,
        "libraries": {},
        "post_scan_hits": 0,
        "searches": 0
      }
    },
    "started_at": 1789191551.3869529,
    "finished_at": 1789191621.155092,
    "phase": "COMPLETE",
    "error": "REQUEST_FAILED",
    "error_kind": "CandidateError"
  }
}
